{
  "schema": "yaaw.model-profiles/v2",
  "version": 2,
  "purpose": "Runtime/model capability policy kept separate from engineering semantics. Runtime adapters resolve actual model identities.",
  "reasoning_order": ["low", "medium", "high", "max"],
  "profiles": {
    "economy": {
      "orchestrator": {"model": "INHERIT", "min_reasoning": "medium", "requires": ["tool_use", "repository_read", "structured_output"]},
      "planner": {"model": "INHERIT", "min_reasoning": "high", "requires": ["tool_use", "repository_read", "structured_output"]},
      "discovery": {"model": "INHERIT", "min_reasoning": "medium", "requires": ["tool_use", "repository_read", "structured_output"]},
      "implementer": {"model": "INHERIT", "min_reasoning": "high", "requires": ["tool_use", "repository_read", "code_edit", "structured_output"]},
      "qa": {"model": "INHERIT", "min_reasoning": "high", "requires": ["tool_use", "repository_read", "structured_output", "fresh_context"]},
      "release-engineer": {"model": "INHERIT", "min_reasoning": "medium", "requires": ["tool_use", "repository_read", "structured_output"]}
    },
    "maximum-quality": {
      "orchestrator": {"model": "INHERIT", "min_reasoning": "high", "requires": ["tool_use", "repository_read", "structured_output"]},
      "planner": {"model": "INHERIT", "min_reasoning": "max", "requires": ["tool_use", "repository_read", "structured_output"]},
      "discovery": {"model": "INHERIT", "min_reasoning": "high", "requires": ["tool_use", "repository_read", "structured_output"]},
      "implementer": {"model": "INHERIT", "min_reasoning": "max", "requires": ["tool_use", "repository_read", "code_edit", "structured_output"]},
      "qa": {"model": "INHERIT", "min_reasoning": "high", "requires": ["tool_use", "repository_read", "structured_output", "fresh_context"]},
      "release-engineer": {"model": "INHERIT", "min_reasoning": "high", "requires": ["tool_use", "repository_read", "structured_output"]}
    }
  },
  "fallback_policy": {
    "never_below_required_capabilities": true,
    "never_below_min_reasoning": true,
    "unavailable_required_profile_is_blocking": true
  },
  "qa_diversification": {
    "standard": "PREFER_DISTINCT_FAMILY",
    "high_assurance": "REQUIRE_DISTINCT_FAMILY_WHEN_AVAILABLE"
  },
  "rule": "Model/profile changes may affect cost and reasoning capacity but may not change routing, authority, ticket, scope, QA or source-of-truth semantics."
}
